{
	"$schema": "http://json-schema.org/draft-07/schema#",
	"type": "object",
	"required": ["name", "version", "dependencies"],
	"definitions": {
		"featureFlag": {
			"anyOf": [
				{ "type": "string", "enum": ["windows", "linux", "macos"] },
				{ "type": "string" }
			]
		},
		"featureList": {
			"type": "array",
			"items": { "$ref": "#/definitions/featureFlag" },
			"description": "Feature flags to enable for this dependency"
		},
		"optionalFlag": {
			"type": "boolean",
			"description": "If true, the dependency is not required for the project to run"
		},
		"packageAlias": {
			"type": "string",
			"description": "Actual package name at the source, when it differs from the require key (aliasing)"
		},
		"rockspecPath": {
			"type": "string",
			"description": "Path to the rockspec file relative to the dependency directory"
		},
		"dependencyObject": {
			"type": "object",
			"additionalProperties": {
				"type": "object",
				"oneOf": [
					{
						"required": ["path"],
						"properties": {
							"path": {
								"type": "string",
								"description": "Local filesystem path to dependency"
							},
							"package": { "$ref": "#/definitions/packageAlias" },
							"rockspec": { "$ref": "#/definitions/rockspecPath" },
							"features": { "$ref": "#/definitions/featureList" },
							"optional": { "$ref": "#/definitions/optionalFlag" }
						},
						"additionalProperties": false
					},
					{
						"required": ["git"],
						"properties": {
							"git": {
								"type": "string",
								"description": "Git repository URL"
							},
							"branch": {
								"type": "string",
								"description": "Git branch to use"
							},
							"commit": {
								"type": "string",
								"description": "Git commit hash to pin"
							},
							"package": { "$ref": "#/definitions/packageAlias" },
							"rockspec": { "$ref": "#/definitions/rockspecPath" },
							"features": { "$ref": "#/definitions/featureList" },
							"optional": { "$ref": "#/definitions/optionalFlag" }
						},
						"additionalProperties": false
					},
					{
						"required": ["version"],
						"properties": {
							"version": {
								"type": "string",
								"description": "Registry package version or range to install, e.g. '^1.2.3', '1.2' or '>=1.2 <2'"
							},
							"package": { "$ref": "#/definitions/packageAlias" },
							"rockspec": { "$ref": "#/definitions/rockspecPath" },
							"features": { "$ref": "#/definitions/featureList" },
							"optional": { "$ref": "#/definitions/optionalFlag" }
						},
						"additionalProperties": false
					},
					{
						"required": ["luarocks"],
						"properties": {
							"luarocks": {
								"type": "string",
								"description": "Package name on luarocks.org"
							},
							"version": {
								"type": "string",
								"description": "Optional version constraint e.g. '>= 1.0'"
							},
							"package": { "$ref": "#/definitions/packageAlias" },
							"features": { "$ref": "#/definitions/featureList" },
							"optional": { "$ref": "#/definitions/optionalFlag" }
						},
						"additionalProperties": false
					},
					{
						"required": ["archive"],
						"properties": {
							"archive": {
								"type": "string",
								"description": "URL to an archive (.zip, .tar.gz, .tar.bz2, etc.)"
							},
							"package": { "$ref": "#/definitions/packageAlias" },
							"rockspec": { "$ref": "#/definitions/rockspecPath" },
							"features": { "$ref": "#/definitions/featureList" },
							"optional": { "$ref": "#/definitions/optionalFlag" }
						},
						"additionalProperties": false
					}
				]
			}
		}
	},
	"properties": {
		"name": {
			"type": "string",
			"pattern": "^(?:[a-z][a-z0-9_-]{1,}[a-z0-9]/)?[a-z](?:[a-z0-9_-]*[a-z0-9])?$",
			"maxLength": 128,
			"description": "Package name (optionally namespaced as ns/name; matches the registry naming rules)"
		},
		"version": {
			"type": "string",
			"pattern": "^\\d+\\.\\d+\\.\\d+$",
			"description": "Semantic version number"
		},
		"description": {
			"type": "string",
			"description": "Short description of the package"
		},
		"authors": {
			"type": "array",
			"items": { "type": "string" },
			"description": "List of package authors"
		},
		"dependencies": {
			"allOf": [
				{
					"$ref": "#/definitions/dependencyObject"
				},
				{
					"description": "Package dependencies with source locations"
				}
			]
		},
		"bin": {
			"type": "string",
			"description": "Entry point script to run when using lde run without a file argument"
		},
		"scripts": {
			"type": "object",
			"description": "Named scripts that can be run with lde run <name> or lde <name>",
			"additionalProperties": {
				"type": "string",
				"description": "Shell command to execute"
			}
		},
		"engine": {
			"type": "string",
			"enum": ["lua", "luajit", "lde"],
			"description": "The Lua engine to use"
		},
		"devDependencies": {
			"allOf": [
				{
					"$ref": "#/definitions/dependencyObject"
				},
				{
					"description": "Development dependencies with source locations"
				}
			]
		},
		"features": {
			"type": "object",
			"description": "Named feature groups, each containing a list of dependency names",
			"additionalProperties": {
				"type": "array",
				"items": { "type": "string" },
				"description": "List of dependency names included in this feature"
			}
		}
	},
	"additionalProperties": false
}
