{
	"name": "lde",
	"version": "0.1.0",
	"dependencies": {
		"json": { "git": "https://github.com/lde-org/json", "commit": "3d170b54416dc432669e35040e454167c75b9b2c" },
		"ansi": { "path": "../ansi" },
		"path": { "version": "^0.1.0" },
		"process": { "version": "^0.1.1" },
		"clap": { "version": "^0.1.0" },
		"fs": { "version": "^0.2.0" },
		"env": { "version": "^0.1.0" },
		"curl-sys": { "version": "0.1" },
		"semver": { "path": "../semver" },
		"lde-core": { "path": "../lde-core" },
		"winapi": { "version": "^0.1.0", "optional": true },
		"git2-sys": { "version": "^0.2.0" },
		"luarocks": { "path": "../luarocks" },
		"readline": { "path": "../readline" }
	},
	"features": {
		"windows": ["winapi"]
	}
}
